{
  "$schema": "https://json-schema.org/draft-07/schema",
  "$id": "https://raw.githubusercontent.com/pvanlaake/zarr-conventions-registry/main/schema/convention.schema.json",
  "title": "Zarr Convention Registry Entry",
  "description": "Schema for a registered Zarr convention entry",
  "type": "object",
  "required": [
    "uuid",
    "name",
    "namespace",
    "description",
    "spec_url",
    "schema_url",
    "maintainers"
  ],
  "additionalProperties": false,
  "properties": {
    "uuid": {
      "type": "string",
      "format": "uuid",
      "description": "Permanent, immutable UUID identifier for this convention"
    },
    "name": {
      "type": "string",
      "minLength": 1,
      "maxLength": 64,
      "description": "Canonical short name of the convention"
    },
    "namespace": {
      "type": "object",
      "description": "Describes how the convention exposes its attributes in Zarr metadata",
      "required": ["style", "key"],
      "additionalProperties": false,
      "properties": {
        "style": {
          "type": "string",
          "enum": ["prefixed", "nested"],
          "description": "prefixed: attributes use a namespace prefix and colon separator; nested: attributes are grouped under a single top-level key"
        },
        "key": {
          "type": "string",
          "minLength": 1,
          "maxLength": 64,
          "description": "For prefixed style: the prefix including the colon, e.g. 'proj:'. For nested style: the top-level attribute key, e.g. 'cs'"
        }
      }
    },
    "title": {
      "type": "string",
      "minLength": 1,
      "maxLength": 128,
      "description": "Human-readable full title of the convention"
    },
    "description": {
      "type": "string",
      "minLength": 1,
      "maxLength": 1024,
      "description": "Short description of what the convention encodes, one paragraph"
    },
    "spec_url": {
      "type": "string",
      "format": "uri",
      "description": "URL of the authoritative specification document"
    },
    "schema_url": {
      "type": "string",
      "format": "uri",
      "description": "URL of the JSON schema for this convention"
    },
    "maintainers": {
      "type": "array",
      "minItems": 1,
      "description": "One or more maintainers: GitHub handles, names, organisation names, email addresses, or any combination",
      "items": {
        "type": "string",
        "minLength": 1
      }
    },
    "maturity": {
      "type": "string",
      "enum": ["proposed", "pilot", "candidate", "stable", "deprecated"],
      "description": "Maturity level using the zarr-conventions-spec tiers"
    },
    "doi": {
      "type": ["string", "null"],
      "pattern": "^10\\.\\d{4,}(\\.\\d+)*/.*$",
      "description": "DOI of the archived stable specification, issuer at author's discretion; required at Stable maturity, otherwise null or omitted"
    },
    "composes": {
      "type": "array",
      "description": "UUIDs of conventions composed by this convention",
      "items": {
        "type": "string",
        "format": "uuid"
      },
      "uniqueItems": true
    },
    "tags": {
      "type": "array",
      "items": {
        "type": "string",
        "minLength": 1,
        "maxLength": 32
      },
      "uniqueItems": true,
      "description": "Domain and topic tags for discovery, e.g. ['geospatial', 'coordinates', 'CF']"
    },
    "version": {
      "type": ["string", "null"],
      "description": "Current version string if the convention is versioned, null otherwise"
    },
    "version_history": {
      "type": "array",
      "description": "UUIDs of prior versions of this convention, in reverse chronological order",
      "items": {
        "type": "string",
        "format": "uuid"
      },
      "uniqueItems": true
    },
    "implementations": {
      "type": "array",
      "description": "Links to known implementations (other than conventions composing this convention)",
      "items": {
        "type": "object",
        "required": ["name", "url"],
        "additionalProperties": false,
        "properties": {
          "name": {
            "type": "string"
          },
          "description": {
            "type": "string"
          },
          "url": {
            "type": "string",
            "format": "uri"
          },
          "language": {
            "type": "string",
            "description": "Primary implementation language, e.g. 'Python', 'R', 'Julia'"
          }
        }
      }
    },
    "registered": {
      "type": "string",
      "format": "date",
      "description": "Date of registration in the registry, set by the registry CDG on merge"
    },
    "status_changed": {
      "type": "string",
      "format": "date",
      "description": "Date of most recent maturity status change, updated by the registry CDG"
    },
    "submitted": {
      "type": "string",
      "format": "date",
      "description": "Date of submission to the registry, set automatically by the workflow on PR open"
    }
  }
}
