{
  "uuid": "bb9ee930-8c60-4c47-ad6b-8daa558987ed",
  "name": "geolocation",
  "namespace": {
    "style": "nested",
    "key": "geolocation"
  },
  "title": "Geolocation Convention",
  "description": "Some geospatial data sets do not have a simple coordinate reference system. A typical example would be a level-1 swath satellite image. Such data sets may have ancillary data structures to provide the geolocation data for the elements in the image, one array for each of longitude and latitude. This convention provides a standard mechanism to refer to such geolocation arrays from the data arrays whose coordinates need to be determined. ",
  "spec_url": "https://raw.githubusercontent.com/R-CF/zarr_convention_geolocation/main/README.md",
  "schema_url": "https://raw.githubusercontent.com/R-CF/zarr_convention_geolocation/main/schema.json",
  "maintainers": [
    "@pvanlaake"
  ],
  "maturity": "proposed",
  "tags": [
    "geolocation",
    "curvilinear"
  ],
  "version": null,
  "composes": [
    "d89b30cf-ed8c-43d5-9a16-b492f0cd8786",
    "f17cb550-5864-4468-aeb7-f3180cfb622f"
  ],
  "implementations": []
}
