{
  "uuid": "e4dbf0b7-7a00-4ce6-b23e-484292014ab4",
  "name": "cs",
  "namespace": {
    "style": "nested",
    "key": "cs"
  },
  "title": "Coordinate Set Convention",
  "description": "Encodes the coordinate structure of a Zarr array following the CF Metadata Conventions model. Supports Cartesian, curvilinear, and parametric coordinate sets including auxiliary coordinate variables, bounds, formula terms, and CF coordinate typing. Designed to be composed with other conventions for CRS, projection, and domain-specific metadata.",
  "spec_url": "https://github.com/R-CF/zarr_conventions_cs/blob/main/README.md",
  "schema_url": "https://raw.githubusercontent.com/R-CF/zarr_conventions_cs/main/schema/cs.schema.json",
  "maintainers": [
    "@pvanlaake"
  ],
  "maturity": "pilot",
  "tags": [
    "coordinates",
    "CF",
    "geospatial",
    "scientific",
    "netCDF",
    "climate",
    "weather"
  ],
  "version": null,
  "implementations": [
    {
      "name": "geozarr",
      "url": "https://github.com/r-cf/geozarr",
      "language": "R"
    },
    {
      "name": "xarray-zarr-xgroup",
      "url": "https://github.com/pvanlaake/xarray-zarr-xgroup",
      "language": "Python"
    }
  ],
  "composes": [
    "f17cb550-5864-4468-aeb7-f3180cfb622f"
  ],
  "registered": "2026-08-01",
  "status_changed": "2026-08-01"
}
