{
  "uuid": "3bbe438d-df37-49fe-8e2b-739296d46dfb",
  "name": "uom",
  "namespace": {
    "style": "nested",
    "key": "uom"
  },
  "title": "Units of Measure",
  "description": "Units of measurement for Zarr arrays",
  "spec_url": "https://github.com/clbarnes/zarr-convention-uom/blob/v1/README.md",
  "schema_url": "https://raw.githubusercontent.com/clbarnes/zarr-convention-uom/refs/tags/v1/schema.json",
  "maintainers": ["@clbarnes"],
  "maturity": "pilot",
  "tags": ["units", "units-of-measure", "UCUM"],
  "version": "v1",
  "implementations": [
    {
      "name": "zarrs_conventions_uom",
      "url": "https://github.com/clbarnes/zarrs_conventions/tree/main/zarrs_conventions_uom",
      "description": "zarrs / zarrs_conventions implementation",
      "language": "rust"
    }
  ],
  "composes": [],
  "registered": "2026-07-31",
  "status_changed": "2026-07-31"
}
